Product Name,Review Text,Review Date,Rating
Dropbox,"i really appreciate dropbox having just used onedrive for a couple of weeks which was a disaster.i'd used free dropbox for a few years without issues and was running out of space so moved all my files to my 1tb onedrive but had lots of problems, so have upgraded to a paid dropbox account and moved my files to that.my only issue with dropbox is it's really confusing to cancel your paid plan, hence 4 stars not 5.",23 Feb 2024,4.0
Dropbox,"our company's transition to dropbox was initially met with enthusiasm, drawn by the allure of unlimited storage amidst known issues like laggy performance, slow uploads, and frequent crashes. despite these drawbacks, the promise of boundless space for our team's data, including private accounts, seemed worth the compromise.however, our trust was shattered when dropbox abruptly announced the cancellation of our unlimited contract with just a few months' notice. this left us in a lurch, not due to excessive use, but amidst an attempt to consolidate our team's storage needs efficiently.seeking a resolution, we were appalled by dropbox's response: an offer to continue our service at a rate 10 times our original contract's cost. this wasn't a slight increase but a staggering, unjustifiable price hike, showcasing a blatant disregard for customer loyalty or fair business practices.this experience has been enlightening, revealing dropbox not as a reliable partner but as a company willing to betray customer trust for profit. the abrupt contract cancellation and ludicrous price proposal highlight a concerning ethos at dropbox, prioritizing profit over service and reliability.for those considering dropbox, let our story serve as a warning. look beyond the initial promises to the potential for unexpected costs and questionable business ethics. our journey from trust to betrayal by dropbox underscores the importance of choosing partners who value fairness and transparency.",16 Feb 2024,1.0
Dropbox,"all went wrong! a tricky question was posed by dropbox, without stating any consequences, so i clicked on yes.  not only all my desktop files disappeared but my desktop is not usable any more!  i can only work online and on dropbox which was not at all my wish.  i spent 3 hours on the chat with no result - all answers are standardized (the name on the chat was clement).  i gave permission to access my account and explained what i wanted.  no result! my computer guy could not find what to do either.",16 Feb 2024,1.0
Dropbox,"why is dropbox most expensive of all the cloud services that exist? i need about 100-200 gb extra storage and checked them all. dropbox is 10 times more expensive than google drive, and about 5 times more expensive than onedrive…",14 Feb 2024,1.0
Dropbox,"i use dropbox to 1) make a secure backup of my files and 2) share files with collaborators. i won't be using dropbox any more as soon as i find a replacement. i had chosen to store all of my dropbox/shared files on my hard drive in addition to in the cloud on dropbox.com for 2 reasons: 1) so i can access my files when i don't have stable internet and 2) so that i have my own copy of the files that i expected would be free from dropbox meddling. how wrong i was. about 3 weeks ago, i noticed some of my (thousands) of shared files were no longer syncing with collaborators. it took me a week before the its-all-something-you-did ""support"" at dropbox actually connected me to tech support. that's a frustrating week where productivity was greatly reduced by having to manually email files back and forth. then, finally with dropbox ""support"" instructions, they had me reconnect to dropbox, which initially caused dropbox to re-sync my entire dropbox -  thousands of files (~350gb), the vast majority of which have been untouched for years and had recently been existing just fine on my hard drive and in dropbox cloud storage. this un-necessary re-syncing was taking days on a metered internet connection. dropbox then instructed me to re-install with a stable version of the app that they provided, assuring me that would stop the unnecessary re-sync of hundreds of gigs of files. i did that, and dropbox deleted my files from my hard drive!!! now they have again instructed me on signing out and re-connecting dropbox, which has caused dropbox to simply hang, unconnected, with all my files hostage in the cloud, if they even exist. support flat out refuses to call me or screen share, but instead, every couple days offers a piece of ""advice"" that only worsens the problem. i see dropbox going out of business soon with their product that is more of a liability than benefit and a complete disregard for customer service of any type.",9 Feb 2024,1.0
Dropbox,"conservatives beware.  i had stored conservative memes and videos in my business dropbox account.  the other day i get a message that my account was disabled for ""violating policies."" all of my photos, videos and files are now gone, based on my political views.  beware of this leftist radical company patriots!",8 Feb 2024,1.0
Dropbox,please be careful when purchasing dropbox. i recently had a fairly substantial sum debited from my paypal account without authorisation or knowledge. i’ve made a number of inquiries and i’m yet to receive a satisfactory response. i’ve researched this issue and it appears this has happened to a number of people - it’s by no means an isolated incident.,5 Feb 2024,1.0
Dropbox,"dropbox's tech support is terrible! when i needed help, they pointed me to justask and said it would cost $1, which was refundable. so, i gave my payment info and justask charged me $56. i reported it to applecard.furthermore, dropbox's navigability and usability is ridiculously inane and unintuitive. i will never use dropbox again. icloud, here i come!",19 Jan 2024,1.0
Dropbox,"terrible!when it first came out it was easy to use and logical.over the years it has become harder and harder to use.now it is just pathetic.  use something else it you insist on saving files to the ""cloud"" where anyone can hack them.",18 Jan 2024,1.0
Dropbox,"how do i get an invoice, reasonable app but what do you need to do to get an invoice.  tells me to go to billing under settings, there is no ""billing"" under settings on my account.  could not recommend",18 Jan 2024,1.0
Dropbox,"honestly, drop box has never lived up to the hype. i am well versed with computers, video uploads & bandwidth. my internet connection is completely stable & let’s me upload long videos just fine on other online services. every 5-7 minutes drop box claims my connection is unstable & changes the remaining upload time from 3 to 2 to 8 to 5 to 7 and back to 3 hours. this is inferior & ridiculous service. i am switching to another one.",15 Jan 2024,1.0
Dropbox,"i've used a paid version of dropbox for many years but just deleted my account and went with another cloud service for storing all of my computer files and sharing them across my multiple devices.i ran into a routine issue that required a password reset and recovery routine, but when i contacted their online customer service, they were unwilling to provide a reset, despite putting me through many days of back and forth, even after verifying my identity.  this type of inflexibility toward long-time paying customers reflects very poorly on management and their customer support operation.  life is too short.  i'm gone.",13 Jan 2024,2.0
Dropbox,"i run a company which does video games, video editing and graphics design. we have a few people working from home. this means we find ourselves sending and receiving large files and collaborating a lot. we had a good few tb of data with dropbox. we had asked for an increase in storage quite regularly, which was given in a very simple, easy message to support.all that changed when dropbox decided they needed more money. they switched to some new way of charging people or something like that. we found that support refused to give us more storage. simply saying they can't do anything. excuse me? can't do anything? you've been doing this for me for almost a full year? i paid for a business account to be told you can't do anything? after a week or so i message again - we're running out of space, we need an increase. again, they can't do anything. we can no longer upload files to the service. we're losing money. a week later, i ask again - i get told no. i say, can i pay for more storage? they once again refuse. what am i meant to do? i can't do anything with this storage, we're losing money, and we're still paying dropbox for just holding our files! simple - we go elsewhere. it took us about a month to move our stuff away but thank god i did.",12 Jan 2024,1.0
Dropbox,"i was not informed that £199 would be taken out of my account for a subscription that i do not use, want or can afford. i was unable to claim this back despite a long virtual chat.",12 Jan 2024,1.0
Dropbox,"the product work ok, but when it does not. do not expect support to help you.support is absolutely hopeless.- seems like then just want to drag it out until you give up trying to get the problem fixed.",11 Jan 2024,1.0
Dropbox,"i've been using db for years and currently manage 4 paid accounts, one of which is a family plan and pay several hundreds of dollars annually.  i upgraded an another additional free account recently to a paid one, but have never been able to use it because one of the pcs keeps logging into the free one, and the online password does not work and i have been unsuccessful in attempting to create a new one.  i have spent today over 2 hours trying to resolve this with support chat today and then i was stunned by what they wrote to me on the chat line and then ended the chat.here is the final message db typed on the chat service...  ""our chat service is intended for professional conversations and dropbox assistance. misuse of this chat may result in temporary or permanent suspension from this chat service. have a great day"".   so, i am unable to log in to a new paid account.  no phone number to call, no support.with all the negative comments i just read here on trustpilot, i feel i need to move all of my services away from dropbox. i am very concerned about the integrity of this company. unfortunately, i will need to look for another service.  this company doesn't seem to be what it once was.  recommendations?",10 Jan 2024,1.0
Dropbox,unreliable.paid for the dropbox transfer service. just doesn't work - all the people i've sent links to with a folder or file over 10gb cant access the file. they get misleading messages and the downloaded file is corrupted.previously lost precious files using dropbox storage -never trust drop box with files - use as cloud storage but you have to back up somewhere else.customer support of little use.,9 Jan 2024,1.0
Dropbox,there’s a reason why there’s only one star reviews! hey customer service is just a word and i  used to be a supporter of this company but not now,9 Jan 2024,1.0
Dropbox,i was recently charged $119.88 for a basic free storage plan. why?? trying to reach this company is a loop of links going no where. horrible customer service is an understatement. do yourself a favor and use google.,4 Jan 2024,1.0
Dropbox,"never had a problem with dropbox until today. most of my recent excel december 2023 files were changed to august 2023. i can't describe how much agony and loss of information this has caused. i wrote support and will have to wait several days. if no solution, i'll delete the app and avoid the website. fyi, i only use 350mb of the 2.25gb available.",28 Dec 2023,1.0
Dropbox,they bribe people with amazon gift cards for positive reviews and they still have a bad rating. terrible for storing and sending large files.,Updated 4 Jan 2024,1.0
Dropbox,"advertised with the standard plan that you had 2tb, but blocked my account when i ""exceeded bandwidth limits"" by uploading 1tb within 24 hours.they emailed me and told me to upgrade my account to resolve the issue. after paying more money i got the same message. exceeded bandwidth limitations, upgrade to resolve the issue.support told me to upgrade to a buisness plan, which requires you to pay for a minimum of three accounts.i feel this constitutes a scam on two separate points.",11 Dec 2023,1.0
Dropbox,"the most helpful thing about dropbox is that i can easily store and manage the documents i need. one of the most helpful platforms for importing documents from google drive is dropbox. the upsides of using this platform are that i can easily share files, and it keeps all my information safe.",4 Dec 2023,5.0
Dropbox,worst customer ever do not use dropbox at any cost!! they are the worst customer service in the world and i hope they lose all their business. rude and unprofessional cs!! do not use!!,2 Dec 2023,1.0
Dropbox,"2fa at login started showing suddenly without me activating it, since i don't have 2fa for dropbox i used a backup code to login. once logged in i turned off the 2fa. exactly one month later it logged me out and asked to login again which is fine, 2fa appeared again!!! tried to use the backup code to login again and guess what, it's not working anymore!!!",28 Nov 2023,1.0
Dropbox,"i am switching cloud data storage and backup providers and decided to use dropbox because of their support for windows, mac and linux, which i use actively.first, as usual, the sales process to get you to sign in, get your credit cards and get to install is super easy and smooth and you even get to chat with a real person. this eventually does not happen after that.second, the linux version eventually does not support a critical feature, backups, which all other platforms support, but you don´t know until you actually wonder where that tab is in the app and why it is lacking ...third, given that i cannot use it on linux, i cannot use dropbox at all, but it is now impossible to cancel the subscription, delete the account and remove my credit card and other info...i manage to find a privacy email where, i have sent a gprd request to remove all my data from their site and delete my account for which i have a ticket number but no real means to contact them.really frustrating and horrendous experience!",25 Nov 2023,1.0
Dropbox,"i have a new laptop, i downloaded the app. it doesnt even ask me to login with my existing account info. impossible to connect my new laptop!!! they say on a basic plan you can have 3 devices connected. they are liars!!!!  it is totally impossible, but if you pay for a plan, then you can do it all. they basically ignore the free plans to force people bying a subscription. they are absolutely thieves!!!!i will use drive from now on....its even better and free....!!!!",18 Nov 2023,1.0
Dropbox,"i'm a digital nomad and have been using dropbox for years. always backing up my photos from my phone and paying $13/month....since my pregnancy with my son.now my son is almost 7 and i am really impressed with google photos. i have been backing up to both the last few years but today i decided i would switch all my files to google photos. my son's baby/infant/first walking stuff is all only on dropbox.but guess what? dropbox won't let me download my old photos. i can see them on the screen but when i try to download them, the file won't download.i have thousands of photos so i thought maybe it's just too much so i broke it down by 50 photo packs. nope.there's no support from dropbox either. you can't email or call anyone, just a message board of people sharing other nightmare scenarios.save your money, do not buy this product!",16 Nov 2023,1.0
Dropbox,"used the free version dropbox uneventfully for several years... until my account was hacked.  my password was changed and it was all downhill from there.if you can not log on to dropbox, you are s.o.l. as there is no means of talking to a person, even remotely via chat, at dropbox.the hacker was constantly sending emails, using my email address, with ""payment receipt"" type spam.  i even got some myself.  the name on my account was changed to farhid yadaydad something... but dropbox continued to send me email about the account.  when spam was sent and people would respond to it, it would come to my email address.so i tried to log back in and reset my password... wouldn't you know, dropbox wanted to email me a ""code"" to verify it was me... that email never came through.i've tried for weeks to to get to a human or someone in support and it is a endless loop of ""sign in"" and then we'll chat with you...i have no idea how this company gets away with this business model on zero customer support!",15 Nov 2023,1.0
Zoom,"just bought a voip number with a houston, texas area code. easy to buy.  setting it up was a f'n nightmare. over one hour chatting with a young lady, polite, great customer support but could not resolve the problem.bill gates deserves a kick in the arse for killing skype.com.",2 days ago,1.0
Zoom,"i have been using zoom since 2019, at that time, i did not know any other company, i used to have a skype account but it was not enough for me based on the limited features it has. to be honest, at the beginning, the service was good,eventhough there are time it was a headache, but i did not have any other choice. 7 months ago, they charged me double on my account. i had to report the issue to my bank until they fixed the problem.zoom doesn't have a customer service,it looks like a robot that processes a reply based on your request.there are times, i feel like they are making fun of me. my service was 13.99 , they keep charging me 20.05 us dollar.i made complaints but everything seems normal to them. they don't want to give me back the extra charge from my account.i have just canceled the service today : 15/07/25some of my friends have issues with zoom too but they don't do nothing, i'm fed up and i want other people have the same problem as me.",5 days ago,1.0
Zoom,"zoom technical support is a myth, it does not exist. its chat support (helped by ai) is incompetent: it copies your message and goes on to ask further questions - none stop - and never finally getting a human to help with problems that zoom login page itself creates. my family members encountered tech problems at every attempt to use zoom communication with third parties (we have logging account with zoom). there is much more critical issue with zoom company: it tricks customers with initial ""$1.00 refundable charge"" which when you agree to the charge turn to be $39 monthly agreement. clearly, zoom is not only incompetent and unable to help, it appears to be unethical and maybe even fraudulent.in conclusion: don't use zoom.",7 days ago,1.0
Zoom,2 months to reply. company should be dying. use google or microsoft,7 days ago,1.0
Zoom,"i know zoom is used by almost everyone, but so are macdonalds eaten by almost everyone too. the two are similar.i don't understand why so many people talk as if it is 'easy' to use. i have to assume they don't understand it.zoom is full of traps. if you use it 'out of the box' it is easy, but the detailed settings are all defaulted because they are not well structured or explained.if you gave someone the keys of a car, someone who hadn't driven a car before, and told them 'it's easy', you would be lying to them. that is how zoom is. but i guess they don't care, they just assume that someone else will explain it eventually, as they continue to throw changes to the settings etc etc. it should have a health warning.",7 days ago,1.0
Zoom,no warning that zoom were renewing my subscription and they do not offer a refund. no prior warning to the payment being taken out and i can't get through to a human. i do not use zoom anymore and would have cancelled it before the renewal but i had no warning when that was.,12 Jul 2025,1.0
Zoom,"i recently switched to zoom as the primary dialer for my center.the costumer service is fenomenal.antoine vattaire was super helpful, he walked me through everything on what plan to use that fits best my needs,he helped me learn all the features in the platform.i had a deadline that i had to figure out my dialer in under 2h, and antoine left everything aside to help me out.it's super affordable and super high quality.i recommend.",10 Jul 2025,5.0
Zoom,i'm disappointed with the lack of zoom technical support.i have been with them for 5 years and i would have to say they seem to be declining in customer care.a bot cannot answer my question to the technical support i need and i feel wherever i try to go with this i cant actually speak to someone.this issue is affecting my business and i need to move on and look for something else.i'm based in the uk and extremely frustrated at the amount of times i have tried to reach out and gotten absolutely nowhere.,7 Jul 2025,2.0
Zoom,they said i cancelled when i called in 2024 and then billed me a year later stating i did not cancel.  i called them a week later after learning.  it was an annual billing.  they refuse to refund me and are keeping me in billing for the year.  i have to call me cc company.  what a pain.  i haven't used it in 1 year and they know this.,7 Jul 2025,1.0
Zoom,"zoom does not give the option to change the interface date format to uk / eu.  this means when you try to filter upcoming meetings the dates are reversed, which is very confusing. i raised it with support and they suggested making a feature request. seriously?? then again i guess the clue is in the domain name: zoom.us.",7 Jul 2025,1.0
Zoom,"today, i attempted to attend meeting through zoom to a kingdom hall of jehovahs witnesses, 0n my laptop computer. the connection went through ok - however i got no audio just visual.this has greatly annoyed me as attending meetings is important to my wife & i. i admit today is the first time i have had an audio issue with zoom...but i do want this situation resolved as soon as humanly possible.i also wish to complain about the difficulty of communicating with a real human being at zoom, preferably in the uk (the total lack of a phone number for customer services or tech support is highly infuriating) i do not deal well with chatbots, or any other form of automated systems - i do deal well with living human beings however!!!!!!!!!!!",6 Jul 2025,1.0
Zoom,"the two stars are for past service. now they're useless.i have a one-year contract with zoom. now, in the middle of the year, they are limiting the number of whiteboards i can keep to three. how can they change the deal after i've already paid?i don't really need more than three whiteboards, but two of the whiteboards on my account were created in meetings where someone else was host -- and i can't delete them. somehow they count against my total even though i have no control over them. so if someone invites me to a zoom meeting and we do something on a whiteboard, then i cannot use a new whiteboard until they delete it. really infuriating is that the only support that is available anymore is a chatbot, which really could not understand my issue at all. when renewal time comes, i will look for different meeting software. i used to love zoom.",4 Jul 2025,2.0
Zoom,"after more than a month of trying to get help because i could not access a second user account i own, i finally got help from a colleague. dozens of emails to zoom about the problem and it was clear that they never once bothered to read anything i wrote. it took an average of a week for me to get any kind of response from them and they kept demanding to know why i wanted access to my own account. never once provided any kind of solution. i wrote telling them we resolved the problem, but they obviously did not read that because they're still emailing me saying they'll be happy to help resolve it.",2 Jul 2025,1.0
Zoom,"truly awfuli spend  long time tried to download zoom   on my personal  laptop. impossible to find a link. it gives workplace downloadand their website is soooo busy and confusing.why fgs,  some schools use  zoom and force parents to have it.",2 Jul 2025,1.0
Zoom,"i was hit with an automatic renewal for $790 for the large group which i never used.  when i saw the charge 3 days later, i cancelled and asked for a refund. they refused - i had never once had a group over 35.  for weeks and weeks zoom has been freezing on me in important meetings.  no wonder people are bashing them - the pandemic made them huge and now they don't care.",1 Jul 2025,1.0
Zoom,"trying to set up zoom phone is impossible. its been a week, 7 different helpdesk people (who you cant speak to unless you have a premium package) and now they are asking for business documents that are impossible to provide as the very nature of those documents mean they are older than 3 months which they wont accept. absolute joke.",26 Jun 2025,1.0
Zoom,"if i could give zoom a zero for their business applications i would. all we needed was to renew with fewer licenses than we had last year and after signing a contract stating we were going to drop licenses from the renewal at the beginning of may, come our renewal in june, nothing was done and they are now acting like we never contacted them. i have been getting bs "" i am sorry to hear that there has not been an update....to best assist you, i will be escalating your concern and will reach out to you with more information as soon as possible."" responses for a month now. i am absolutely going to cancel the full account and never go back. 0 out of 10.",25 Jun 2025,1.0
Zoom,my outlook email was created through imap. zoom cannot be integrated with it. i basically paid for a service that i cannot use. have to manually copy paste link and it is extremely inconvenient. i was not warned that imap is not supported when signing up.,25 Jun 2025,1.0
