Product Name,Review Text,Review Date,Rating
Adobe,"adobe is a damn loser, we already pay monthly for a subscription for years and now the are going to enroll 'credits' for generative fill? how bad is business going? why do you need too empty your customers pockets.. deeply dissapointed, can't wait till other softwares whipe adobe away. bad management and brokey decisions.",21 hours ago,1.0
Adobe,i would give adobe minus 10 if i could.i wanted a quick job done and thought i would take advantage of the ‘free’ trial.not only didn’t i get it done- found it too complicated i got stung by their dirty sign up clauses.i should have checked trustpilot first!i would have never signed up!as a result of not cancelling before the 7 days i got hit by a £119 early cancellation fee!liars and cheats!as a result i will publicise this cowboy outfit for their underhanded way of recruiting unwary people,A day ago,1.0
Adobe,"i regret ever getting involved with adobe. after reading all the negative reviews, i now understand why people are frustrated. their plans are impossible to cancel without facing excessive cancellation fees. support is unprofessional and unreliable—they either leave the chat or can't provide answers. my advice: if you're already stuck with them, the only way out is to block your card, get a new one, and never deal with them again.",2 days ago,1.0
Adobe,"adobe is an excellent product not gonna lie, but you have to pay adobe, if you dont want to use them anymore is crazy.",3 days ago,1.0
Adobe,"1* is far too much for this company. i took out a free trial to convert one document, cancelled before the end date and received an email to confirm. just checked bank account and found they have taken 2 months money for another service i did not sign up for. nearly an hour on their chat bot, repeating this is fraud on their behalf. offered to cancel, waive cancellation fees and would refund one months money. told them no and eventually got acccount closed, no cancellation fee and both months refunded. i thought adobe was a reputable company obviously not - beware",3 days ago,1.0
Adobe,"i wish there was an international business ethics committee keeping tabs on businesses like adobe and other monopolist extortionists. while the rest of us are living from pay to pay, they seem to be doing a great job of increasingly profiteering from their ongoing existence, while screwing the rest of us out of our own financial existence. they and others like them obviously won't change because they don't need to.",3 days ago,1.0
Adobe,i know pirate pages that are way more legit than these scamers !!,4 days ago,1.0
Adobe,"my husband signed up for their free trial because it was the only way to finish a single document we needed to close on our home. he forgot to cancel it and so we got charged for the month after the 7days. he then proceeded to cancel the subscription. we paid for that month we forgot to cancel. next month we see a pending charge from adobe. we call customer service and they proceed to tell us there were two subscriptions and we only canceled one (and of course it was the large bill we didn’t cancel). we stay on the line trying to get it cancelled and to stop the charge or get refunded. customer service then hung up on us without even canceling the subscription. mind you, we never even got notified either time that the subscription was going to renew. i then called customer service back and they told me we cannot get refunded because we passed the 14 day refund date. how does that work? our subscription renewed the 10th of july and i called on the 14th. how is that past the 14 days? terrible customer service.",6 days ago,1.0
Adobe,"a suite of marketing tools designed to help businesses manage customer experiences across various channels. it includes analytics tools, content management systems (cms), advertising solutions, and more.",6 days ago,5.0
Adobe,"please be careful about their free trial. it,s a trap and you will regret for it.they charged me £62 for signing up for the free trial.so, please careful.",6 days ago,1.0
Adobe,"this is a fraud company, they change your contracts, increase prices, auto renewal without even informing you. and charge you a cancellation fee.the worst part is when consumers complain, a lawsuit gets filled, they accept their fault and pay a fine to the government. this company should be banned everywhere.",6 days ago,1.0
Adobe,"if i could give negative stars, i would. i signed up for a trial period to use their pdf converter. sometimes it worked okay, but often it converted the documents incorrectly. therefore, i cancelled the free trial. i just realized, i have been charged for two months service!! i cancelled again & received a message the service would be on through august. i don't want your service, i want my $65 back!! i've tried to find a phone number on their website to reach customer support, but none is to be found. this is absolutely unacceptable. shame on you adobe!!!",12 Jul 2025,1.0
Adobe,"this is the worst customer service i have ever dealt with. they are money hungry and will do anything to make sure you can’t cancel. if you accidentally get a subscription, you are going to have to pay like 100 something dollars total or you’ll have a cancellation fee that is ridiculous overpriced.",12 Jul 2025,1.0
Adobe,adobe is a god awful app that charges way too much for use.,10 Jul 2025,1.0
Adobe,"my subscription jumped from 11$ dollars to over 18$. i wanted to know why, so i started a chat with their support. given the fact photoshop has become increasingly unstable, crashing due to gpu errors etc. (my gpu works just fine by the way), i wanted to stick to the original price.the support person went on a rant how great they are and the great value they provide and suggested that i pay more with some other cloud plan for the same services. what? then they locked the support chat before i could reply.i went to cancel the plan only to find that they also penalize you for cancelling and charge you... what a nice company. i am done with adobe and will be looking for a different sw asap.",10 Jul 2025,1.0
Adobe,"complete sham. get everyone needing the product, then extort them by peeling back what can be done for free, to the point that it is completely useless.",9 Jul 2025,1.0
Adobe,"adobe has discontinued support for fireworks but continues to make it available on creative cloud. no alternative available from adobe, so have to go elsewhere to find anything as good. shocking customer service.",9 Jul 2025,1.0
Adobe,"in 2010, i purchased a lifetime license for adobe acrobat. the product was properly paid for and activated at the time, and i used it without any issues for years. however, approximately six months ago, the software began displaying messages stating that the license key had been revoked. while the program still opens, it constantly prompts me to enter a valid key and occasionally closes documents unexpectedly.i contacted adobe support, and the only solution offered was to provide proof of purchase. but we’re talking about a purchase made 15 years ago — very few people keep receipts for such long periods, especially for a lifetime license, which by definition should not expire or be deactivated.it appears that this was a deliberate deactivation of valid keys, likely based on the assumption that most users would be unable to prove their purchase after so long. worse still, adobe now only offers me subscription-based options (monthly or annual), which i consider an abusive practice.i paid a significant amount at the time for a perpetual license. now, with no prior notice, i am being denied access to what i legally purchased and am being pressured to switch to a subscription model.i respectfully demand that my original license be reactivated, or that i be provided with a new perpetual key, as per the original agreement.",9 Jul 2025,1.0
Adobe,you will regret it with every bone in your body that you gave it a chance.,8 Jul 2025,1.0
Adobe,"paid out—£21.98toadobedate posted07 july 2025more informationproadobetypedebit card transactiontransaction date05 july 2025i paid twice to adobe to create a video. i cannot create the video; i enter the video to create it. adobe demanded more money to upgrade when i was unable to create a single video from them, instead demanding money without service. please, adobe, refund my money; i paid twice to you without service.",8 Jul 2025,1.0
Adobe,"terrible. muy caro, muy intrusvo y para cancelar te ponen mil pegas-",7 Jul 2025,1.0
Adobe,seriously?  you just raised the price for the photography plan by 40%?  do you realize how much american products are in jeopardy here in europe because of your stupid government?  we are finding alternatives and boycotting as much as possible.  and you raise prices by a huge amount?,7 Jul 2025,1.0
Adobe,"auto signs you up to an annual contract after free trial instead of a monthly contract which is normal with most subscriptions. hefty cancellation charge. for anyone else in this situation, if you contact customer support, they can give some free months subscription which helps lower the cancellation charge",7 Jul 2025,1.0
Adobe,keeps on thinking that my account is wrong even though it is right so i would like this to be deleted now before i call the po pos ,6 Jul 2025,1.0
Adobe,i asked for refung and it takes 4 different ppl to start new chat agian and again  after 1hour finali i get refund.,5 Jul 2025,1.0
Adobe,i'm surprised. why all these negative reviews!!!my experience with adobe is very good.,4 Jul 2025,5.0
Adobe,shameful conduct from adobe - not only do they charge a subscription fee rather than allowing you own the product outright(!) but now they have increased the price of my plan by 50% for the exact same product with no justification whatsoever.the only upside is it's finally pushed me to stop using this awful company. used to have great respect for them but will never buy another product.,4 Jul 2025,1.0
Adobe,"i have been with adobe a while  and always  thought they were fair to deal with until my last   subscription . i  took the 7 day free trial .  i got no reminder email or anything to cancel.  i can't contact them , i cant find an email.   its impossible to get in contact with them  .  i really wont use them again after this experience.  so  upset about  this experience",3 Jul 2025,1.0
Adobe,"after being with this company for 7 years ive had technical issues so their ai chat tis as much helo as a choclate fire guard and eventually i chatted wiht the most ignorant and foolish custmoed service person ih vae ever encounteet the amount of lies they told me then when i asked for a transcript of the chat they said they would send it and instead disconnedcted , i took screen shots and am reportingthem ot trading standards",2 Jul 2025,1.0
Adobe,"if i could give a minus 10, i would. basic english is not an option with adobe india division, which seems to be every interaction. adobe should have better smarts, your bottom line will catch up to the quality of the corporate decisions to pay peanuts, and get about the same.",2 Jul 2025,1.0
Adobe,product works okay but cheaper better options out there. they try and lock you in to 2 year fees when leaving and then charge a cancellation fee. not worth it with other softwares to use,2 Jul 2025,2.0
Adobe,"the software is fine and has always been fine. my review is about customer experience. adding an extra user license takes seconds. easiest thing in the world. removing a license is a pain in the ass and they purposefully make you jump through hoops to get it done. there's early cancellation fees if you want to remove a license before 'contract expiry' and free cancellation is only possible within a termination window. i get that you want to maximize company revenue but adobe has done so, consistently, at the expense of giving customers a product/service they actually enjoy using. we have a flexible team and we may need more licenses for a product occasionally for a short time. unless you want to get stuck paying for these licenses for a year or more, even if nobody is using them, do not use adobe. adobe's disregard of user experience makes sure that at the earliest possibility i will switch to comparable software with a better pricing and more license/user flexibility. this way of doing business is not the future.",2 Jul 2025,1.0
Adobe,"omg i wish i had researched this company before subscribing. i've been a sub in the past, and never have they done me dirty like this before. f adobe. i hope they burn for literally scamming anyone and everyone into using their software.",2 Jul 2025,1.0
Adobe,"i've been with adobe since cs3 and have always appreciated their tools. but my recent experience has left me frustrated.before switching plans, i had over 90 asset credits saved—adobe's way, i thought, of rewarding loyalty. i was told i’d receive 40 new credits and that my library would carry over. neither happened. my dashboard showed only 10 credits, and despite confirming this with an agent (with screenshots sent), my session was closed without resolution.the worst part? adobe can follow up with a survey, but not with actual help.why penalize long-time users? i’ve filled out every product survey, shared my feedback, and stayed loyal. this feels like a letdown. adobe, please do better.",1 Jul 2025,2.0
Adobe,"long time video editor and motion graphics designer here. i just cannot understand why adobe seem to be doing their very best to make their apps as bad as possible on an overly fast release cycle.everything is broken, bugs are never fixed, desperately needed features not implemented.  even on just the most basic level, they completely fail to deliver.  the after effects team in particular should be ashamed.",1 Jul 2025,1.0
Adobe,"scam company, leave small print rules to their subscriptions to get you caught in a commitment. not the best way to conduct business, especially for design software. do not buy.",1 Jul 2025,1.0
Adobe,"today after 2 hrs online. adobe informs me i have to purchase a new program.  my box does not say i am only allowed 2 downloads. i have deleted, uninstalled and factory reset other laptops.adobe does not stand behind their products. only wants me to re purchase.  very negative unhelpful experience.",30 Jun 2025,1.0
Adobe,"i can cancel netflix for free and use it sparingly. this i needed for school for a couple months, but when i went to cancel it i was charged $50. i do not recommend. back to ""the good old days"" of charging fees for canceling a subscription i only needed for a couple months. if you're not going to use it for the entire contracted time, don't sign up. borrow someone else's. this is why we hate contracts, school is only for 8-9 months, but you're charging us for the whole year? end up getting access to the (insert job i get hired for) subscription so why do i need to pay for time i'm not using it for? let alone be charged an outrageous fee for cancelling it early? never again.",30 Jun 2025,1.0
Adobe,please do not subscribe to adobe unless you plan to use it all year. regardless of whether you pay monthly or yearly you are required to pay high cancellation fees.beware of the scam|,30 Jun 2025,1.0
Adobe,"i am very disappointed with the adobe acrobat subscription. i found what i thought was their student offer for one year, but it redirected me to another link showing a price of £16. i assumed it was the student rate, but then they deducted £16 each month for three months. when i tried to cancel, they wanted me to pay an additional £73.i also tried to speak to someone from their support team, but they deliberately ended the conversation without resolving anything. this feels like a clear case of money drain and they should be taken to court.”",30 Jun 2025,1.0
Adobe,"the customer support in the uk is unacceptable, with management, including uk md suzanne steele and customer experience manager (louise watkins), ignoring numerous complaints. the offshore support is terrible, and the company seems indifferent to their customers' needs. avoid buying from this company due to poor product support. it's shameful and will eventually cost their bottom line!.",30 Jun 2025,1.0
Adobe,"a wide range of products, but very expensive compared to the competition.use premiere pro for video editing, but the monthly costs include loads of other apps i don't ever use.  can be buggy and crash, have seen lots of recomendations for an alternative that i'm planning to swap to once my 1 year is up.",30 Jun 2025,3.0
Adobe,"i didn't have access to all i paid for in adobe pro.  after spending hours trying to see what i was not doing incorrectly (it must have been me, because surely it wouldn't be adobe, right?) i opened a chat and told the agent i wasn't able to use all the features for which i was paying.  he asked if i downloaded adobe pro.  (i have the adobe app on my desktop, so why do i need to download again?)  i downloaded the app as instructed and it was so large my computer didn't have memory resources to handle the install.  i told the agent i just wanted to cancel because the program is unusable to me.  he said if i did, i would have a $99 cancellation fee!  evidently this is buried somewhere in the agreement. i read reviews about adobe to see if there were issues and yes! lots of complaints just like mine.  the ftc and doj have a pending lawsuit because of these issues.",30 Jun 2025,1.0
Adobe,"adobe are the biggest scammers ever. do not  sign up for a subscription i am telling you now. i thought i had canceled my subscription two months ago. only for me to be getting charged last month and today. i called them asking why i was being charged if i had canceled my subscription two months ago. i wanted my money back. i even have the email as proof it was canceled. they said that i had only canceled the ai version?? i was so confused, the adobe cancellation screen said i only had one service. i am enraged. and on top of that they charge you a large fee for cancellation. mine is $90. don't even try signing up for a free trial you will get scammed.",27 Jun 2025,1.0
Adobe,so i recently had to contact adobe to change my plan from monthly to annual payment. what i can't quite understand is why my plan is £5 more expensive than it should be.the photography plan should be £119.76 including vat per year but they are randomly charging me £124.42 including vat per year and they took 3 weeks off my plan duration.everyone else i know that changed their plan is paying £120. they offered no explanation why. adobe are getting so greedy they will nickel and dime you for every inch. duplicitous company.update: i attempted to contact adobe again today (7/7/25) to follow up. they have apparently sent a refund for the lost month. after 7 working days no sign of it even though they have up-to-date payment info.i asked again about the mysterious price increase. they did not answer my question and instead ended the chat without warning. i've updated the score to reflect just how terrible adobe's support is. i can't tell if they are stupid or just deliberately terrible.i'm going to learn how to use affinity photo and capture one with the intent of not giving this unethical company any more money. least of all for ai nonsense.,Updated 7 Jul 2025,1.0
Adobe,they keep charging you money even if you canceled and then charge you a cancelation fee. total bs.,26 Jun 2025,1.0
Adobe,"awful company that charge you 3.5months of your monthly subscription price to cancel. increased the monthly price by 50% this year and i didn’t notice until it auto renewed, then i had to pay over £50 to cancel!",26 Jun 2025,1.0
Adobe,"never been a fan, but they are getting worse. how hard is it to redeem an elements download? very. no support of course. if i was an it illiterate you might just think i was stupid. it pro for years running servers and networks. they make it soo hard.",26 Jun 2025,1.0
Adobe,"what a dreadful, unhelpful company this is. i have a file i cannot remember putting a password on so therefore cant remember the password, i’ve tried password i have ever used, nothing. got into private chat with them and they were no help whatsoever.",25 Jun 2025,1.0
Adobe,"extremely disappointed with adobe.i reported a billing issue multiple times — no solution till now.they keep closing chats, making fake promises, and worst of all:there’s no official email to escalate complaints!this is not just bad service — it’s blatant disrespect.never trusting adobe again.#adobefail #customerdisrespect #noescalationpath #worstsupportever",25 Jun 2025,1.0
Adobe,"adobe took away the right to own one's software, effectively increasing the price of their tools a thousandfold. they also reserve the right to take away these tools at anytime and have done that to an entire country in the past. their focus is primarily on advertising and spending their time developing their products for their own ends and not that of their customers. the adobe 'experts' at hand to answer questions are the kapo that serve their masters and not their fellows. overall adobe is in my opinion an unethical company who will go down on the wrong side of history for caring more about power and excess wealth than people.",25 Jun 2025,1.0
Adobe,"rude customer support, rude company, charge you money to cancel your subscription. do not use at any cost",25 Jun 2025,1.0
Adobe,it can only help you of you allow them to access your system which is ridiculous! they refer clients to read “how to” instructions that they cannot follow themselves!,24 Jun 2025,1.0
Adobe,went to go use the acrobat customisation wizard.website only provides exe installer for reader.1 star,24 Jun 2025,1.0
Adobe,they demand a cancellation fee of over 100 bucks if you want to cancel your program early. nowhere is something like this stated. the paying program is very obscure and feels like a scam.,24 Jun 2025,1.0
Adobe,"- you wanna buy their apps, but you can't. there's only subscription.- you choose to buy a full year upfront pay. everything is ok.- when the year ends, they renew the same subscription with new price (more expensive), without even asking for your confirmation.- you see on your credit card debt and scream ''i didn't buy aother year, i didn't even get verification code from my bank. let me just cancel it.- the funny story starts now. if you didn't realize it on your credit card transcript and a bit late to cancel, you have to pay the early fee.- luckly i wasn't too late, so i contacted a support and asked them to cancel the 2nd year sub.- buuuut, i didn't get what i paid. so i contacted them again and asked why.- they said ''yes you asked for use to cancel, but you didn't ask for refund''. funniest thing i've ever ever withnessed.- anyways, and this year, i got a reminder on photoshop that i'm out of ''credits''.- apparently now they are charging you extra for using features that's been there for years like ''generative fill''.- i am done with this company. and i've been using these apps for 30 years now. i'll just use something else, i don't care.",23 Jun 2025,1.0
Adobe,"never get the free trial, if you forget to cancel they will sign you up for a mandatory year or service paid at $20 a month which is ridiculously overpriced for the small amount of features it provides. if you cancel before the year is up ($240) you must pay a $60 fee. free trials are often predatory but this is next level stuff. i will avoid them whenever possible in the future.",22 Jun 2025,1.0
Adobe,i would give adobe zero stars if possible.  in my opinion this is a terrible predatory company.  i signed up for one of there plans at around 40 dollars a month and eventually i noticed that the price almost doubled.  i decide to cancel and received a notice that i would have to pay an early cancellation fee of over 350 dollars.  what!!!  i no longer want their subscription service and they are trying to penalize me for cancelling.  that is ridiculous!!!  i cancelled and will fight them through my credit card company.  this company uses sleazy business practices and i highly recommend you avoid them like the plague!,20 Jun 2025,1.0
Adobe,we have 3 computers on three site - we use adobe for document and contract editing - even for the free version they limit the number of devices to 3 - which is completely over the top - most tech companies have more than one computer per staff.... 2 is way too low as it is the minimum limit...  because there is mfa in place - only checking every so often would work better than limit the number of devices...,20 Jun 2025,1.0
Adobe,"i’ve been charged monthly by adobe systems ireland without my consent or the ability to stop it. despite trying every possible way to contact them – emails, support tickets, and multiple calls .i have received absolutely no response or follow-up. no callbacks, no emails, nothing.this situation has gone on for far too long and is extremely frustrating. there is no clear way to get help or even speak to a real person. this is completely unacceptable from a global company of this size.honestly, it feels like a scam at this point. taking people’s money without support or resolution is shameful. i expected much more from adobe, but this experience has completely ruined my trust in the company.avoid at all costs unless you want to deal with unauthorized charges and zero customer support.",19 Jun 2025,1.0
