Product Name,Review Text,Review Date,Rating
Salesforce,"i am owner of 100employee company and we were told by many salesforce is the place to go to consolidate your sales. but do not do that. the interface is clumsy and complex. for basic stuff, like having the same view of the clients for all colleagues, you almost need to pay integrator. reporting is a nightmare. the worst of all - due to the expired billing method that we were not aware - we were locked out of the account. what is even more bizarre is the fact you cannot update your billing method once you are locked out of the account. of course our customer support contact became unresponsive, general customer support does not answer any emails - obviously. long story short, i have to call and beg on different numbers so we can gain the access to the data that we own. i honestly do not know why organisations use the service.",9 Sept 2024,1.0
Salesforce,"i got lots of scam and spam emails from salesforce.com. they are all illegitimate and tries to pose as meta to phish scam information from me. i report that and block them, and new ones emerge. my alarm bells ring as soon as i see salesforce.  it's bad news!",27 Aug 2024,1.0
Salesforce,thief’si cancelled my plan about 4 months ago and they keep charging me. there’s no billing department that can help you cancel over the phone. you have to send an email which they will not reply to you after you make a “ticket” with customer service. they ended up reaching out to me via email 2 months after i made the “ticket” just to tell me that it’s my fault because i kept sending them the payment. it’s automatically on autopay and there’s no way to take it off. only way is to call your bank.the only department they have over the phone is tech support. everything else is done by email.nightmare of a company to deal with. i highly suggest not to use them.,26 Aug 2024,1.0
Salesforce,"when my business needs changed, i chose not to renew salesforce. however, they continued billing me $924.16 without my knowledge. despite having records of these charges, salesforce required me to obtain transaction receipts from my bank. after i provided the receipts, they only refunded $303, citing an auto-renewal clause i wasn’t fully aware of. they plan on keeping $621.16, which i find unfair. this experience ensures i’ll never do business with salesforce again, and i strongly advise others to avoid them as well.",25 Aug 2024,1.0
Salesforce,"i have been using a variety of salesforce products like sales, service cloud etc. it is very helpful in automating crm processes. it has a well defined set of workflows to handle customer experience and engagement across multiple platforms",23 Aug 2024,4.0
Salesforce,all about money.  waste of time.,22 Aug 2024,1.0
Salesforce,"only reason i'm giving it a 2 is because it does function... somewhat. the ui is so clunky and frustrating, i cannot even begin to express how non-intuitive it is. they need a better designer, or product testing team, or something. we tried it out, got stuck with them for a year because of a contract, and have since moved onto a different crm.",10 Aug 2024,2.0
Salesforce,"salesforce is not a user application for sales! it is merely a data entry platform that uses a very primitive ui to access sql databases through static reports. lightning has been their 'new' ui for a decade & is still being 'rolled out'.task 'management' is literally just a list that doesn't do reminders and is wholly manual. technically, you can label a task as a reminder, but it's only a label; it doesn't do anything.all data is managed manually. automating anything is difficult and time consuming. the standard sf response to setting up automations or connecting functions that the modern user would expect is, ""of course it can do that! oh, wait no, no, it cant do thaaat. but you can generate a report"".the most ridiculous advice from sf experts is to export to a spreadsheet. why are we paying for a crm that is only useful if the data managed in a spreadsheet?",Updated 9 Aug 2024,1.0
Salesforce,don't bother with their customer service. they're just sending me in circles at this point.,5 Aug 2024,1.0
Salesforce,"our trial of salesforce starter was ultimately unsuccessful. we found the platform to be slow and its user interface outdated and intimidating. this experience highlights the challenges of finding a suitable crm for our needs.we also encountered data loss issues with zoho tables, although they were eventually resolved.in an a/b test comparing salesforce starter ($25/month) and zoho bigin ($12/month), zoho bigin emerged as the more favorable option. salesforce's pricing model can be prohibitive for small businesses, as it often involves additional charges for seemingly minor features.we believe salesforce could significantly benefit from offering a more affordable and user-friendly crm solution specifically tailored to the needs of small businesses, similar to zoho bigin, at a competitive price point of around $20 per month.",Updated 24 Jan 2025,1.0
Salesforce,"absolute crap from top to bottom.  i wish i could give it a negative rating! tons of hype and in my opinion it’s slow, template is terrible, outdated, feels like it’s lacking in technology and you have constant malfunctions.  in the end it was irritating to the customers and made communication more difficult.  cost me sales and it took away from my presentation made me look unorganized and not well prepared.   been an issue for six months and yesterday was ridiculous mess had to not use it…look for options ….",Updated 1 Aug 2024,1.0
Salesforce,"we are a wholesale flooring company. my sales manager thought would be a good idea to get salesforce for sales rep to take order straight from customers and generate sales reports faster. we want the sales rep have the ability to see inventory on hand, take sale orders, take customer data, send sales order to customer and take payments. in the first day, we stated those objectives and want something mirror of our company qb, but only on sale/customer side. it took salesforce 6 months to have an interface to present and start training me. the interface is so difficult to navigate and not user friendly. it is like navigator through labyrinth to take order. they could only provide take order, and everything else has to be done by our quickbooks software. they had the nerve to say that we didn't state our objectives clearly, but that was what they presented to us as sales side would be done by salesforce interface. there is no point paying subscription fee and we have to use quickbooks for everything. as company's chief accountant, i called to end it.",31 Jul 2024,1.0
Salesforce,"sf is not as straightforward, simple and great as they make themselves out to be.  beware.",28 Jul 2024,2.0
Salesforce,"we had salesforce for two years trying no to get it going for our business. we wanted it to work but all their support team is incompetent! after many attempts to make changes to our platform to get it to work for us, we decided to go with another company. we still had to pay the year because the rep that we were informed to contact to cancel our subscription kept putting us off. not replying to our emails. we called several times to cancel and so three months later of finally getting a hold of someone they would give us any kind of help and were forced to pay the rest of the year. we tried to work with sales force and called their support team to make changes on our platform until we had enough. we didn't use their program for the entire year and told them that we had been trying to cancel and sent emails that we wanted to cancel but of course they don't care about customer support or service. we still had to pay the entire year because their employees suck at communication and don't have knowledge on their own program.we will never work with them again nor do i recommend them. especially for restoration, plumbing, contractors.stay away from this company!!!",25 Jul 2024,1.0
Salesforce,"this company needs to be investigated. they are publicly listed due to the fact that they are in bed with multi million dollar corporations who have a never-ending supply of money, however, their sales staff are trained to target small to medium businesses who are then misled into buying software that not only cost a ridiculous amount of money but fails completely to meet expectations. if you buy this software, you will very quickly realise that once you’ve signed the dotted line, the sale staff will drop you like a stone and you’ll be left completely hopeless, paying for licenses you do not require with absolutely no support and a product that doesn’t work. it doesn’t matter if the software doesn’t work one bit, they will charge you, and take you all the way through to debt collection just to get their money. shareholders are the only people who matter in sf. they are complete rip-off merchants. our company was promised a completed platform february 2 and, as i write this email we still do not have a platform that works. our franchise owners have lost thousands, we have lost hundreds of thousands and our reputation has been jeopardised because of salesforce. we have decided that legal action needs to be pushed upon these thieves. my email address is mastercanavan(at)i.c.l.o.u.d.com (replace (at) with @ and take out the dots to make cloud) if you have been impacted by this company, please reach out to me via email. i will compile as much evidence as possible and go straight to the media. let’s put a bit of a dent in this brands reputation.",25 Jul 2024,1.0
Salesforce,"this program is not designed for small business people. seems like most things are extra. and the extra charges are substantial.the program is confusing.i try to hire experts, but they want between $150 to $250 hr.you can hire someone from india, but they are hard to understand. the cost of someone in india is much less.the program should have easy integration between quickbooks online, gmail, google calanders.",23 Jul 2024,2.0
Salesforce,"this is absolutely putrid!never seen such a convoluted maze to get through and see a lead and update it.you want to take time off the sales staff and not get them to sell then use this app.if you don't use it, you'll sell more cars.i've been selling cars for 30 years and successful being sent all over the world winning trips and this is the worst i have ever used.avoid at all costs.",20 Jul 2024,1.0
Salesforce,"what has gone right,  not a single thing. this system is a failure and our entire staff of 500+ feel like we were sold a lemon from a shady used car salesman. our company has now made the news and i'm sure the lawsuits have started. i'm just a little person within the company and have no say but i have been here for 9 yrs and for the first time,  i hate coming to work having to deal with this crap of a system.",19 Jul 2024,1.0
Salesforce,"i was on the training yesterday and omg it's like the software was written by a pregnant skitsofrenik women, it is lengthy and down right useless. waste of money and all the trainers say is trust the system. i wouldn't trust that system if my life depended on it. bunch of scumbags",17 Jul 2024,1.0
Salesforce,"i am writing this review to express my profound disappointment with the customer service experience i have had with salesforce over the past several months. my company, the master's lawn & pest, initially engaged salesforce for their services, but due to unexpected staffing issues, we requested to pause our services on february 5th. despite following up a week later, our account manager did not respond to either email.the only response we received was from a salesforce contractor assisting with implementation, who was friendly, understanding, and reassured us that we could continue working with salesforce once we had restaffed and trained for the vacant positions. this individual gave us hope and made us feel that salesforce was committed to helping us through our transitional period.however, that was the extent of the positive experience. the rest of the salesforce team ignored our emails until the issue of payment arose. months later, we finally received a response—focused solely on an overdue invoice. there was no acknowledgment of our previous attempts to communicate, no apology for the lack of response, and no flexibility or concern for our situation. instead, we were met with a canned response about contract obligations, which would have been crucial information for us to know back in february.now, five months after our initial email, we are being threatened with collections for a service that has not been used during this time. despite our intention to move forward with salesforce implementation after resolving our staffing issues, this experience has left us with an extremely bitter taste. the customer service, or rather the complete lack thereof, has been appalling.salesforce's indifference to our situation and the lack of communication from their team has been shocking. we expected more from such a reputed company. unfortunately, their lack of customer care and concern has driven us to terminate any future plans of working with them.",12 Jul 2024,1.0
Salesforce,"every morning (really about 8 out of 10 times) i try to log in the authenticator never remembers i have auto detection. so i have to always select ""allow"" auto detection when logging. nada!  every day!  other times when i try to log in doesn't even give me the option to approve or deny log in.  then you have to clear your cache or do something on your end for their system to work.  it is soooo annoying.  that is just one of the many issues we have.",10 Jul 2024,1.0
Salesforce,i have never ever experienced such poor customer service as i have with salesforce. stay far away from this company!,3 Jul 2024,1.0
Salesforce,i’m incredibly upset because i was scammed into “testing out” the premier success plan for my nonprofit. i was told it was a 2 month test and we could renew if we liked it. i hated it and said i did not plan to renew. it takes forever to schedule a 1:1 session and all they do is direct you to trailhead (the free resource library).i then got hit with a 1 year bill for premier and they will not cancel it. the team said i was notified by the renewal but i was not. no where in the contract did it state that the premier plan would auto renew but apparently it’s their “policy for all contracts”. communication with support is going in circles and i’m crushed that they would take advantage of a small nonprofit like this.,1 Jul 2024,1.0
Salesforce,"salesforce is one of the worst contact management softwares i have ever used in my 15 years as a salesperson. contact management and time management are the two most important aspects of your day when running your practice and i still can't believe how bad salesforce is at this after using the platform for so many months now. i have given it a fair chance and my expectations were reasonably high based on what i was told it would be like but they have grossly over promised and severly underdelivered. i honestly don't know how people use it for effective contact management and relationship building with clients and customers. it is clunkly, non intuitive, simple tasks take way too many clicks and time, it's very slow, and i mean very slow to load compared to other platforms i have used and for what we should expect for our internet speed and just the expectations of technology today. not to mention the expectations set by sf. it's not that hard to learn as i heard from some reviews in the beginning. i think some people get feedback mixed up with learning curve and just horrible processes. anyone who is in sales knows how important contact tracking and activity tracking are. i love to track for my business and i am a very good at taking care of clients because of my attention to details. with sf, it takes many more clicks and actions for the most basic logging of activities. it makes no sense, not even from a managerial level as our compliance team has complained about how to best monitor activities with the way the system requires us to enter info. think about it like this: your a bakery chef and someone comes to you and says they are going to build you a custom kitchen, the best custom kitchen that will help you cook and serve customers. they build the kitchen and stick the cooling racks for the baked goods on the opposite side of the kitchen from the ovens, not next to them, as far away as possible. you ask them to update it, and they seemingly can't. it truly feels like whoever developed the software has very little to no experience in sales or any position that requires relationship management. i have asked a number of peers in my industry and in other industries about their experience with sf and every single person i have talked to hates it and has similiar feedback to me even though they have their own customised versions. from my experiences, you would have to have some really terrible crm software for salesforce to be an improvement.",25 Jun 2024,1.0
Salesforce,"if i could give a zero star rating i would. please save yourself the money & headaches and avoid this company at all costs.we paid for 3 licenses with salesforce maps added and access to the premier success plan to “lighten the lift” as they put it.premier success plan was nothing but a joke (and a $1500 usd touch). every “expert” was uneducated on the field they worked in. never got any help, just a constant game of running around in circles with them. told we’d have access to support whenever we needed it with this additional add-on, turns out it’s 5-7 business days to talk to someone & then every time we connected with them they were unable to answer any questions or help in any sort of way. i was offered a refund for the premier success plan as they acknowledged i never received the service. when i went to take that offer i was told “no we can’t do that anymore”. just constant games & lying with this company.as for our 3 licenses, my team’s been locked out of our accounts for 2 months. their support said “reach out to your account representative”. i emailed 3 times, no response. on the last email, i said “just cancel my account”. then i received a call right away from my account manager david mourad saying “sorry, i assumed someone else was dealing with it.” here we are 2 months later, no service, no refunds & locked into working with this terrible company.all they care about is getting you locked in to a contract & collecting their payments. once the contracts signed, their service goes to zero.stick to a lower cost crm program that has better service & doesn’t lock you in to working with them even when they don’t provide the service provided.",18 Jun 2024,1.0
Salesforce,"if i could do zero stars i would. salesforce has been the most unsupportive, manipulative, unhelpful software company i've ever worked with.do not be fooled by the sales process. they will make it sound like butterflies and rainbows until you sign the contract. from then on, i wouldn't count on receiving any support or help from anyone. oh and be prepared for them to nickel and dime you at every turn. your ""rep"" will change every 2 weeks, and they're useless anyways because everything has to go through ""approval"". but everything gets denied so don't get your hopes up.i reached out 3 months prior to our renewal date. they finally got back to me (after going through apparently 2.5 months of ""approvals"") 1 week prior to our renewal date. i asked for revisions that continually came back incorrect up until 2 days prior to the deadline. i asked for some leeway to review with my superiors considering they took 11 weeks to get back to us and i was sent a nasty and unyielding email back saying if we don't sign by end of day tomorrow we will be forced into whatever agreement they originally suggested and they will implement without our approval (which was a 10% increase by the way).they know they can get you to implement your software for tens of thousands of dollars and then are stuck unless you want to go back to square one.awful awful company. spare yourself the heartache and look elsewhere.",13 Jun 2024,1.0
Salesforce,"do not buy for healthcare or medium/ small business. scammed in to 16 users, 3 year contract, 1 million text messages only for outgoing, lightning scheduler, and was paired with a garbage partner. i’ve spent 6 months, $400k, hours and hours of my and several employees time trying to get the software to work for us. at this point i am backing out and will not be using the software are all. huge loss, i should have read this forum before purchasing. i bought in to their hype and reputation.",24 May 2024,1.0
Salesforce,"absolutly terrible to use!! slower than windows 95, customers and me as an agent have to wait on averge 5 minutes for this shait to work!!!often have to clear cookies just to make it work.how can salesforce be such a big company and have no intrest in actually making a product that works?!?!?1its beyond my knowledgehave used this shaitty software for shy of 3 months and man is bad, youll have it easier to to free the people of north korea than it is to make salesforce do the simpliest thing.never buy this!!!!",22 May 2024,1.0
Salesforce,"the most user-unfriendly software i have ever worked with. you'll need extreme support to walk through the simplest of tasks, and you'll spend all day trying to figure out how to navigate through online videos and such. even after figuring out how to use it, i still hate it.",15 May 2024,1.0
Salesforce,"i am extremely dissatisfied with the service i have received from salesforce. despite repeated requests, i have consistently faced issues that have not been adequately addressed, leading to considerable frustration.firstly, i requested quotes multiple times, but they were not provided in a timely manner, if at all. this lack of responsiveness has caused significant delays and inconveniences in my planning and decision-making processes.additionally, i requested changes to the number of licenses before the renewal period, but these requests were refused, leaving me with an inflexible and unsuitable service package. i was informed about the renewal six months ago and asked to be contacted closer to the renewal date, but nobody reached out. when i inquired about the renewal two weeks in advance, i was told it would be impossible to make any changes. instead of receiving the requested quote, after more than a week, i was informed that the service had already been renewed without any option to make changes. to make matters worse, the service was auto-renewed with increased pricing without any confirmation from our end.this rigidity and lack of communication do not align with the dynamic needs of my business and demonstrate a clear disregard for customer satisfaction and adaptability.",14 May 2024,1.0
Salesforce,their marketing and sales team are really aggressive and slightly decietful what they promise vs what they deliver are very differnt once you sign contract the marketing team is gone,10 May 2024,1.0
Salesforce,"my company uses salesforce because its software we know. however, now that we’ve had about 4 months of service with them, we’re rethinking our commitment.first, the software is insanely expensive and the basic out of the box functionality is not reliable. (salesforce, check my trouble tickets)we have had to employ a third party expert to get in and make changes to things like admin vs general user permissions- you know- because why would we want a general user to be able to delete other people’s records?when the expert then says “hmm… this is odd, the changes i’ve made aren’t working. i’ll have to submit a trouble ticket”, i am now paying the person to get your support people online to tell him it’s a glitch on their end and nothing he can fix. please stand by and we’ll flip switches on our end… i still have to pay that person for salesforce’s issues. so for that, i’m quite irritated that the cost isn’t the cost. i have to pay a professional because i don’t know if i’m doing it wrong or if salesforce just isn’t working today.functionality issues aside, the billing department is useless. “we would have been able to accommodate your requests if you had reached out to us prior to xyz date.”my reply: i have forwarded you two examples of when i reached out prior to xyz date and received no response.”(insert salesforce mea culpa here)salesforce also doesn’t tell you that they’ll discuss your account information with anyone they think they should. but fear not! the information they provide you won’t be accurate anyway- so it really doesn’t matter.does this inaccurate and unauthorized information exchange matter to them? no!you’ll get a reply that you should know better. but not an actual apology for their misinformation or mishandling of information.it doesn’t matter if this issue causes a panic, costs money on our end, or eats up our own valuable time. everything is the customer’s fault.save money and time by going elsewhere. at this juncture, i think we’ll have our own crm built because in the long run, it will save us money and hassle.",4 May 2024,1.0
Salesforce,the support team are amazing at their jobs. the billing team however are a complete waste of time and have cost my business thousands with their errors.,3 May 2024,1.0
Salesforce,great system.if you get locked out due to a recurring billing error.they are very slow to turn you back on meaning your whole team cannot access the system for days even after you  make payment.,27 Apr 2024,1.0
